{
  "schema_version": 1,
  "fixture_set_id": "world-surface-health-temporal-perceptual-adapter-20260502",
  "schema_ref": "schemas/world-surface-temporal-perceptual-health.schema.json",
  "generated_from": [
    "vault-spec:2026-04-30-canonical-temporal-grounding-ontology",
    "vault-audit:2026-04-30-temporal-bands-perceptual-grounding-responsible-synthesis",
    "schema:temporal-band-evidence-envelope.schema.json",
    "module:shared.perceptual_field_grounding_registry",
    "schema:world-surface-health-envelope.schema.json"
  ],
  "declared_at": "2026-05-02T11:49:00Z",
  "producer": "cc-task:world-surface-health-temporal-perceptual-adapter",
  "required_observation_categories": [
    "temporal_band",
    "perception_state",
    "perceptual_field",
    "stimmung",
    "autonomous_narration_context",
    "impingement_evidence"
  ],
  "required_temporal_bands": [
    "retention",
    "impression",
    "protention",
    "surprise"
  ],
  "fail_closed_policy": {
    "stale_temporal_band_allows_current_claim": false,
    "missing_temporal_band_allows_claim": false,
    "unknown_temporal_band_allows_claim": false,
    "unknown_perception_state_allows_public_live": false,
    "inferred_perceptual_data_satisfies_witness": false,
    "spanless_perceptual_data_satisfies_grounded_claim": false,
    "protention_satisfies_current_claim": false,
    "autonomous_narration_without_wcs_health_allowed": false,
    "impingement_without_witness_satisfies_claim": false
  },
  "metrics_refs": [
    "metrics:hapax_wcs_temporal_false_grounding_risk_total{cause}"
  ],
  "rows": [
    {
      "row_id": "temporal.impression.broadcast_health.fresh",
      "display_name": "Fresh impression: broadcast health",
      "category": "temporal_band",
      "temporal_band": "impression",
      "status": "healthy",
      "freshness": {
        "state": "fresh",
        "ttl_s": 30,
        "observed_age_s": 2,
        "source_ref": "shm:/dev/shm/hapax-temporal/bands.json",
        "checked_at": "2026-05-02T11:49:00Z"
      },
      "confidence": 0.93,
      "authority_ceiling": "public_gate_required",
      "privacy_state": "public_safe",
      "rights_state": "public_clear",
      "public_private_posture": "public_live",
      "source_refs": [
        "shm:/dev/shm/hapax-temporal/bands.json",
        "wcs:audio.broadcast_voice.health"
      ],
      "producer_refs": [
        "producer:temporal-bands"
      ],
      "consumer_refs": [
        "consumer:world-surface-health",
        "consumer:public-live-claim-gate"
      ],
      "route_refs": [
        "route:temporal-band:impression"
      ],
      "substrate_refs": [
        "substrate:temporal-bands",
        "substrate:audio.broadcast_voice.health"
      ],
      "capability_refs": [
        "capability:temporal-bands",
        "wcs:audio.broadcast_voice.health"
      ],
      "evidence_envelope_refs": [
        "temporal-evidence:impression.broadcast-health.fresh"
      ],
      "witness_refs": [
        "witness:audio.broadcast_voice:world",
        "witness:audio_safe_for_broadcast:safe"
      ],
      "span_refs": [
        "span:archive.hls.segment00042",
        "span:audio.broadcast.window.0042"
      ],
      "grounding_gate_refs": [
        "gate:world-surface-grounding:passed",
        "gate:temporal-band:impression:fresh"
      ],
      "public_event_refs": [],
      "grounding_key_paths": [],
      "false_grounding_risk_causes": [],
      "blocker_reason": null,
      "warnings": [
        "fresh_impression_still_needs_public_event_or_egress_gate_before_public_claim"
      ],
      "fallback": {
        "mode": "none",
        "reason_code": "fresh_impression_observed",
        "operator_visible_reason": "Fresh impression evidence is present but this row does not grant public claim authority.",
        "safe_state": "inspectable_not_public_claimable"
      },
      "kill_switch_state": {
        "state": "clear",
        "evidence_refs": [
          "kill-switch:temporal-perceptual:clear"
        ]
      },
      "owner": "world-surface-health-temporal-perceptual-adapter",
      "next_probe_due_at": "2026-05-02T11:49:30Z",
      "witness_policy": "witnessed",
      "fixture_case": "healthy_witnessed"
    },
    {
      "row_id": "temporal.retention.camera_scene.stale",
      "display_name": "Stale retention: camera scene",
      "category": "temporal_band",
      "temporal_band": "retention",
      "status": "stale",
      "freshness": {
        "state": "stale",
        "ttl_s": 30,
        "observed_age_s": 120,
        "source_ref": "shm:/dev/shm/hapax-temporal/bands.json",
        "checked_at": "2026-05-02T11:49:00Z"
      },
      "confidence": 0.88,
      "authority_ceiling": "evidence_bound",
      "privacy_state": "public_safe",
      "rights_state": "public_clear",
      "public_private_posture": "public_live",
      "source_refs": [
        "shm:/dev/shm/hapax-temporal/bands.json",
        "scene-detector:studio"
      ],
      "producer_refs": [
        "producer:temporal-bands",
        "producer:studio-scene-detector"
      ],
      "consumer_refs": [
        "consumer:world-surface-health",
        "consumer:public-current-claim-gate"
      ],
      "route_refs": [
        "route:temporal-band:retention"
      ],
      "substrate_refs": [
        "substrate:temporal-bands",
        "substrate:perceptual-field"
      ],
      "capability_refs": [
        "capability:temporal-bands",
        "claim:last-observed-only"
      ],
      "evidence_envelope_refs": [
        "temporal-evidence:retention.camera-scene.stale"
      ],
      "witness_refs": [
        "witness:scene.detector.window.0042"
      ],
      "span_refs": [
        "span:scene.detector.window.0042"
      ],
      "grounding_gate_refs": [],
      "public_event_refs": [],
      "grounding_key_paths": [],
      "false_grounding_risk_causes": [
        "stale_temporal_band"
      ],
      "blocker_reason": "stale_retention_cannot_ground_current_or_public_live_claim",
      "warnings": [
        "retention_requires_last_observed_age_window_language"
      ],
      "fallback": {
        "mode": "block_public_claim",
        "reason_code": "stale_retention_current_claim",
        "operator_visible_reason": "Retention is only last-observed evidence and is stale for current/live claims.",
        "safe_state": "last_observed_only_with_age_window"
      },
      "kill_switch_state": {
        "state": "clear",
        "evidence_refs": [
          "kill-switch:temporal-perceptual:clear"
        ]
      },
      "owner": "world-surface-health-temporal-perceptual-adapter",
      "next_probe_due_at": "2026-05-02T11:49:30Z",
      "witness_policy": "witnessed",
      "fixture_case": "stale"
    },
    {
      "row_id": "temporal.protention.audio_readiness.expected",
      "display_name": "Protention: audio readiness expected",
      "category": "temporal_band",
      "temporal_band": "protention",
      "status": "degraded",
      "freshness": {
        "state": "fresh",
        "ttl_s": 20,
        "observed_age_s": 0,
        "source_ref": "shm:/dev/shm/hapax-temporal/bands.json",
        "checked_at": "2026-05-02T11:49:00Z"
      },
      "confidence": 0.74,
      "authority_ceiling": "speculative",
      "privacy_state": "public_safe",
      "rights_state": "public_clear",
      "public_private_posture": "dry_run",
      "source_refs": [
        "shm:/dev/shm/hapax-temporal/bands.json",
        "wcs:audio.broadcast_voice.health"
      ],
      "producer_refs": [
        "producer:temporal-bands"
      ],
      "consumer_refs": [
        "consumer:world-surface-health",
        "consumer:autonomous-narration-preflight"
      ],
      "route_refs": [
        "route:temporal-band:protention"
      ],
      "substrate_refs": [
        "substrate:temporal-bands",
        "substrate:audio.broadcast_voice.health"
      ],
      "capability_refs": [
        "capability:temporal-bands",
        "claim:anticipatory-only"
      ],
      "evidence_envelope_refs": [
        "temporal-evidence:protention.audio-readiness.expected"
      ],
      "witness_refs": [],
      "span_refs": [],
      "grounding_gate_refs": [],
      "public_event_refs": [],
      "grounding_key_paths": [],
      "false_grounding_risk_causes": [
        "protention_as_current"
      ],
      "blocker_reason": "protention_cannot_ground_current_or_action_happened_claim",
      "warnings": [
        "protention_may_only_render_hedged_anticipatory_language"
      ],
      "fallback": {
        "mode": "dry_run_badge",
        "reason_code": "protention_anticipatory_only",
        "operator_visible_reason": "Protention is prediction, not present-tense evidence.",
        "safe_state": "anticipatory_language_only"
      },
      "kill_switch_state": {
        "state": "clear",
        "evidence_refs": [
          "kill-switch:temporal-perceptual:clear"
        ]
      },
      "owner": "world-surface-health-temporal-perceptual-adapter",
      "next_probe_due_at": "2026-05-02T11:49:20Z",
      "witness_policy": "inferred",
      "fixture_case": "inferred"
    },
    {
      "row_id": "temporal.surprise.camera_scene.mismatch",
      "display_name": "Surprise: camera scene mismatch",
      "category": "temporal_band",
      "temporal_band": "surprise",
      "status": "degraded",
      "freshness": {
        "state": "fresh",
        "ttl_s": 30,
        "observed_age_s": 2,
        "source_ref": "shm:/dev/shm/hapax-temporal/bands.json",
        "checked_at": "2026-05-02T11:49:00Z"
      },
      "confidence": 0.81,
      "authority_ceiling": "evidence_bound",
      "privacy_state": "public_safe",
      "rights_state": "public_clear",
      "public_private_posture": "dry_run",
      "source_refs": [
        "shm:/dev/shm/hapax-temporal/bands.json",
        "scene-detector:studio"
      ],
      "producer_refs": [
        "producer:temporal-bands",
        "producer:studio-scene-detector"
      ],
      "consumer_refs": [